{
  "redaction_policy": {
    "policy_id": "rp-safe-default",
    "redacted_fields": [
      "password"
    ],
    "truncated_fields": [
      "raw_payload"
    ],
    "redaction_reason": "Default safe rendering policy",
    "pii_detected": false,
    "pii_types": []
  },
  "telemetry": {
    "trace_id": "trace-20260308-002",
    "span_id": "span-20260308-002",
    "baggage": {
      "workflow": "routing"
    }
  },
  "schema_fingerprint": {
    "schema_id": "https://weaver-spec.dev/contracts/v0/frame.schema.json",
    "schema_version": "0.1.1",
    "content_hash": "1111222233334444555566667777888899990000111122223333444455556666",
    "hash_algorithm": "sha256"
  },
  "confidence_score": 0.92,
  "source_capability_version": "2.4.1",
  "extra": {
    "region": "eu-west-1",
    "latency_ms": 128
  }
}
